{
  "schemaVersion": 1,
  "profileRevision": 1,
  "studentId": "demo-001",
  "windowsUsername": "DEMO-SCHOOL\\demo01",
  "graduationYear": 2029,
  "issuedAt": "2026-10-26T10:00:00Z",
  "keyId": "demo-key-not-installed",
  "accountId": "synthetic-sid-001",
  "prerequisites": {
    "italianProfile": "yes",
    "informaticsBridge": "no",
    "informaticsImp": "yes",
    "continuousBilingual": "yes",
    "religionEthicsGrade10": "KR",
    "sportExemptSemesters": [],
    "continuedLanguages": ["E"],
    "religionEthicsPermission": "unknown",
    "religionEthicsExamPermission": "unknown",
    "permanentSportExemption": "no"
  }
}
